{
  "title": "力学小楼",
  "stages": [
    "初中",
    "高中",
    "大学"
  ],
  "featured": [
    "2.1",
    "3.1"
  ],
  "layers": [
    {
      "L": 0,
      "name": "地基",
      "sub": "描述运动的语言"
    },
    {
      "L": 1,
      "name": "运动",
      "sub": "怎么动"
    },
    {
      "L": 2,
      "name": "力与运动",
      "sub": "为什么这样动"
    },
    {
      "L": 3,
      "name": "守恒",
      "sub": "不看过程也能算"
    }
  ],
  "regions": [
    {
      "name": "运动学",
      "color": "#1565C0",
      "desc": "位置、速度、加速度"
    },
    {
      "name": "动力学",
      "color": "#2E7D32",
      "desc": "力怎样改变运动"
    },
    {
      "name": "能量",
      "color": "#EF6C00",
      "desc": "功和能"
    }
  ],
  "nodes": [
    {
      "id": "0.1",
      "name": "参考系与位移",
      "one": "先选参照物，再说位置怎么变",
      "stage": "初中→高中",
      "layer": 0,
      "region": "运动学",
      "what": "描述运动先要选一个参考系；位移是从起点指向终点的有向线段。",
      "from": "日常经验：同一辆车，路边的人看它在动，车上的人看它不动。",
      "next": "有了位移，才能定义速度（1.1）。",
      "use": "导航、测速。",
      "eg": "从家到学校直线距离 2 km，位移大小就是 2 km。",
      "type": "起点",
      "tags": [
        "【定义】"
      ]
    },
    {
      "id": "1.1",
      "name": "速度",
      "one": "位移随时间的变化率",
      "stage": "初中→高中",
      "layer": 1,
      "region": "运动学",
      "what": "速度＝位移÷时间，有大小也有方向。",
      "from": "用位移（0.1）除以所用时间。",
      "next": "速度的变化率就是加速度（1.2）。",
      "use": "测速、算到达时间。",
      "deps": [
        {
          "id": "0.1",
          "kind": "用到",
          "how": "位移除以时间",
          "main": true
        }
      ],
      "type": "结论",
      "points": [
        "v＝Δx／Δt"
      ],
      "group": "G1"
    },
    {
      "id": "1.2",
      "name": "加速度",
      "one": "速度变得多快",
      "stage": "高中",
      "layer": 1,
      "region": "运动学",
      "what": "加速度＝速度的变化量÷时间。",
      "from": "速度（1.1）也会变，于是再问一次“变得多快”。",
      "next": "牛顿第二定律（2.1）说明加速度由合力决定。",
      "use": "汽车百公里加速、刹车距离。",
      "deps": [
        {
          "id": "1.1",
          "kind": "推出",
          "how": "速度再求一次变化率",
          "main": true
        }
      ],
      "type": "结论",
      "points": [
        "a＝Δv／Δt"
      ],
      "counterexamples": [
        "速度大，加速度不一定大：匀速飞行的飞机 a＝0"
      ],
      "group": "G1"
    },
    {
      "id": "2.1",
      "name": "牛顿第二定律",
      "one": "F＝ma",
      "stage": "高中",
      "layer": 2,
      "region": "动力学",
      "what": "物体的加速度与所受合力成正比，与质量成反比：F＝ma。",
      "from": "实验中改变拉力和质量，测加速度（1.2），总结出比例关系。",
      "next": "沿位移累积力，得到功和动能定理（3.1）。",
      "use": "算火箭推力、电梯里的超重失重。",
      "deps": [
        {
          "id": "1.2",
          "kind": "用到",
          "how": "力决定加速度",
          "main": true
        }
      ],
      "type": "结论",
      "importance": 3,
      "tags": [
        "【定律】"
      ],
      "conditions": [
        "惯性参考系",
        "宏观、低速"
      ],
      "points": [
        "F合＝ma，加速度方向与合力方向相同"
      ],
      "notes": [
        "F 是合力，不是某一个力"
      ]
    },
    {
      "id": "3.1",
      "name": "动能定理",
      "one": "合力做的功＝动能的变化",
      "stage": "高中",
      "layer": 3,
      "region": "能量",
      "what": "合力对物体做的功等于物体动能的变化：W＝ΔEk。",
      "from": "把牛顿第二定律（2.1）沿着位移累积起来。",
      "use": "不必知道运动过程的细节，也能算末速度。",
      "deps": [
        {
          "id": "2.1",
          "kind": "推出",
          "how": "F＝ma 沿位移累积",
          "method": "累积",
          "detail": "以恒力为例：F＝ma 两边乘位移 Δx，再用 v₂²－v₁²＝2aΔx 化简",
          "main": true
        }
      ],
      "type": "结论",
      "importance": 2,
      "points": [
        "W合＝½mv₂²－½mv₁²"
      ]
    }
  ],
  "chains": [
    {
      "name": "从位移到能量",
      "path": [
        "0.1",
        "1.1",
        "1.2",
        "2.1",
        "3.1"
      ]
    }
  ],
  "methods": [
    {
      "name": "变化率",
      "desc": "一个量变得多快：用它的变化量除以所用时间",
      "nodes": [
        "1.1",
        "1.2"
      ],
      "direction": "描述变化快慢",
      "signal": "看到“速度”“加速度”“变化率”",
      "examples": [
        "速度是位移的变化率（1.1）",
        "加速度是速度的变化率（1.2）"
      ]
    },
    {
      "name": "累积",
      "desc": "把每一小段的效果加起来",
      "nodes": [
        "3.1"
      ]
    }
  ],
  "toolbox": [
    {
      "name": "完全平方公式",
      "formula": "$$(a+b)^2 = a^2 + 2ab + b^2$$",
      "source": "代数",
      "usedBy": ["2.1"],
      "notes": "展开力的合成"
    }
  ],
  "entries": [
    {
      "pattern": "求加速度",
      "targets": [
        {"case": "已知力和质量", "nodes": ["2.1"], "hint": "牛顿第二定律"},
        {"case": "已知速度变化", "nodes": ["1.2"], "hint": "加速度定义"}
      ]
    }
  ],
  "groups": [
    {
      "id": "G1",
      "name": "运动的描述",
      "one": "位置怎么变、变得多快",
      "what": "用速度、加速度描述物体怎样运动：速度说位置变得多快，加速度说速度变得多快。",
      "use": "一切运动问题的第一步。"
    }
  ]
}